Properties of the Tangle for uniform random and random walk tip selection.pdf,1594456090766.0754,1594456090918.4485,1594456097167.8733,6249.424934387207,6401.7980098724365
Proteus- A Scalable BFT Consensus Protocol for Blockchains.pdf,1594456099407.6748,1594456099430.0435,1594456099639.018,208.97459983825684,231.34326934814453
Prototype of Blockchain in Dental care service application based on Hyperledger Composer in Hyperledger Fabric framework.pdf,1594456101803.625,1594456101923.138,1594456102108.1042,184.9663257598877,304.47912216186523
Proximity Neighbor Selection in Blockchain Networks.pdf,1594456104250.152,1594456104353.1956,1594456104786.197,433.0012798309326,536.0448360443115
Puncturable Signatures and Applications in Proof-of-Stake Blockchain Protocols.pdf,1594456106984.5183,1594456107634.4873,1594456108202.8516,568.364143371582,1218.3332443237305
Punishment not Reward- Disincentivising Blockchain Application Misbehaviour.pdf,1594456110367.9353,1594456110382.3586,1594456110477.0237,94.6650505065918,109.08818244934082
Remote Configuration of Integrated Circuit Features and Firmware Management via Smart Contract.pdf,1594456112559.1006,1594456112668.882,1594456112846.8472,177.9649257659912,287.7464294433594
Reputation-based Byzantine Fault-Tolerance for Consortium Blockchain.pdf,1594456115008.597,1594456115073.396,1594456115426.3608,352.9648780822754,417.76394844055176
Research on Government Information Sharing Model Using Blockchain Technology.pdf,1594456117646.7402,1594456117690.3481,1594456117801.3506,111.00244522094727,154.61039543151855
Research on Modify Protection of Metrology Electronic Certificate Based on Blockchain Technology.pdf,1594456119904.3706,1594456119927.28,1594456120290.2883,363.0082607269287,385.91766357421875
Review of Blockchain Technology Vulnerabilities and Blockchain-System Attacks.pdf,1594456122450.6548,1594456122481.3125,1594456122746.321,265.00844955444336,295.6662178039551
RobustPay- Robust Payment Routing Protocol in Blockchain-based Payment Channel Networks.pdf,1594456124912.6248,1594456124939.7603,1594456125149.7795,210.01935005187988,237.15472221374512
RSP Consensus Algorithm for Blockchain.pdf,1594456127389.6382,1594456127443.624,1594456127548.624,105.00001907348633,158.98585319519043
Scalable Blockchain-based Architecture for Massive IoT Reconfiguration .pdf,1594456129631.1694,1594456129673.2043,1594456129872.1948,198.9903450012207,241.02544784545898
Scalable distributed random number generation based on homomorphic encryption.pdf,1594456132054.4734,1594456132098.917,1594456132359.9233,261.00635528564453,305.4499626159668
Scalable Privacy-Preserving Query Processing over Ethereum Blockchain.pdf,1594456134487.9478,1594456134526.9485,1594456134848.9724,322.023868560791,361.0246181488037
Scaling Blockchains- A Comprehensive Survey.pdf,1594456137020.9365,1594456137207.4722,1594456137855.4712,647.9990482330322,834.5346450805664
Section-Blockchain- A Storage Reduced Blockchain Protocol| the Foundation of an Autotrophic Decentralized Storage Architecture.pdf,1594456140028.047,1594456140452.9924,1594456144050.077,3597.0845222473145,4022.0298767089844
Security Management and Visualization in a Blockchain-based Collaborative Defense.pdf,1594456146251.6343,1594456146276.873,1594456146635.881,359.0080738067627,384.246826171875
Segment Blockchain A Size Reduced Storage.pdf,1594456148836.4993,1594456150407.0981,1594456150690.0647,282.96661376953125,1853.5654544830322
Simulating a Blockchain Network with SimBlock.pdf,1594456152849.9016,1594456152875.343,1594456153186.3098,310.96673011779785,336.4081382751465
Smart Blockchain Badges for Data Science Education.pdf,1594456155424.331,1594456155466.9067,1594456155658.9182,192.01135635375977,234.5871925354004
Smart Contract Defense through Bytecode Rewriting.pdf,1594456157847.792,1594456157881.9304,1594456158120.94,239.00961875915527,273.1480598449707
Smart Contract-based Secured Business-to-Consumer Supply Chain Systems.pdf,1594456160290.778,1594456160375.1694,1594456160703.2664,328.096866607666,412.4882221221924
SSP- Self-Sovereign Privacy for Internet of Things using Blockchain and MPC.pdf,1594456162917.1958,1594456162979.04,1594456163203.0405,224.0004539489746,285.8448028564453
Tackling Data Inefficiency- Compressing the Bitcoin Blockchain.pdf,1594456165367.0935,1594456165411.464,1594456167016.8096,1605.3452491760254,1649.7159004211426
Teaching Blockchain for Business.pdf,1594456169139.8257,1594456169177.363,1594456169375.373,198.01020622253418,235.54754257202148
TendrilStaller Block Delay Attack in Bitcoin.pdf,1594456171518.8447,1594456173721.289,1594456174289.624,568.3348178863525,2770.7793712615967
The Design of a Mobile Number Portability System on a Permissioned Private Blockchain Platform.pdf,1594456176464.4163,1594456176493.838,1594456176687.8455,194.00763511657715,223.42920303344727
Token-based Sharing Control for IPFS.pdf,1594456178901.3665,1594456179010.7495,1594456179310.721,299.971342086792,409.35444831848145
Toward a Decentralized Marketplace for Self-Maintaining Machines.pdf,1594456181468.7642,1594456181646.7708,1594456181942.7349,295.96424102783203,473.970890045166
Toward a Decentralized| Trust-Less Marketplace for Brokered IoT Data Trading Using Blockchain.pdf,1594456184125.8628,1594456184198.1838,1594456184470.1492,271.96550369262695,344.2864418029785
Towards Application Portability on Blockchains.pdf,1594456186573.8215,1594456186751.1765,1594456186979.179,228.00230979919434,405.35736083984375
Towards Blockchain Interoperability Improving Video Games Data Exchange.pdf,1594456189151.2224,1594456189175.6997,1594456189372.6772,196.9776153564453,221.45485877990723
Towards Post-Quantum Blockchain- A Review on Blockchain Cryptography Resistant to Quantum Computing Attacks.pdf,1594456191478.6138,1594456192333.4646,1594456192770.4624,436.9978904724121,1291.8486595153809
Towards Secure and Decentralized Sharing of IoT Data.pdf,1594456194873.3857,1594456194912.4258,1594456195301.0164,388.59057426452637,427.6306629180908
Traceability in Permissioned Blockchain.pdf,1594456197427.2356,1594456197455.9688,1594456197768.936,312.96730041503906,341.70055389404297
Trinity- A Byzantine Fault-Tolerant Distributed Publish-Subscribe System with Immutable Blockchain-based Persistence.pdf,1594456199895.5188,1594456199938.932,1594456200128.933,190.0012493133545,233.4144115447998
Trust access authentication in vehicular network based on blockchain.pdf,1594456202310.5679,1594456202549.8418,1594456203985.845,1436.0032081604004,1675.2772331237793
TrustChain- Trust Management in Blockchain and IoT Supported Supply Chains.pdf,1594456206198.7952,1594456206325.0515,1594456206597.0535,272.0019817352295,398.2584476470947
Unleashing the Full Potential of Blockchain Technology for Security-Sensitive Business Applications.pdf,1594456208770.2893,1594456208795.702,1594456209100.787,305.0851821899414,330.49774169921875
Why Blockchain Is Important for Software Developers| and Why Software Engineering Is Important for Blockchain Software (Keynote).pdf,1594456211292.3438,1594456211312.603,1594456211384.3967,71.79379463195801,92.05293655395508
Will Blockchain Technology Become a Reality in Sensor Networks.pdf,1594456213525.3826,1594456213571.0623,1594456213700.063,129.00066375732422,174.6804714202881
Yugala- Blockchain based Encrypted Cloud Storage for IoT Data.pdf,1594456215798.8115,1594456215918.327,1594456216086.3342,168.00737380981445,287.5227928161621
zk-AuthFeed- How to Feed Authenticated Data into Smart Contract with Zero Knowledge.pdf,1594456218306.6208,1594456218386.0461,1594456218922.0115,535.9652042388916,615.3905391693115
